competencias;comp_original;parent_cod;cod
planificar urbanismo coordinar desarrollo zona urbanas;Planificar el urbanismo y coordinar el desarrollo de zonas urbanas;c02222;c0222262
politica requerimiento ey aplicar estilo estandare calidad ey toda comunicacione interna externa comprender aplicar metodologia;Politicas y requerimientos de ey aplicar estilos y estandares de calidad de ey en todas las comunicaciones internas y externas comprender y aplicar la metodologia;c00144;c0014463
portale canale digitale atencion conocimiento desarrollo ( excluyente ) conocimiento base dato ( excluyente ) experiencia metodologia agile experiencia liderazgo equipo desarrollo autonomia orientacion resultado aporte innovadore comunicacion eficaz establecer prioridades;En portales  canales digitales de atencion conocimientos de desarrollo (no excluyente) conocimientos de base de datos (no excluyente) experiencia en metodologias agiles experiencia en liderazgo de equipos de desarrollo autonomia orientacion a resultados aportes innovadores comunicacion eficaz establecer prioridades;c00144;c0014464
preparación pellejo piele cuero uso ulterior fabricación reparación producto textile prenda vestir sombrero calzado producto similare .;Preparación de pellejos pieles o cueros para su uso ulterior y fabricación y reparación de productos textiles prendas de vestir sombreros calzado y productos similares.;c00000;c00000141
preparar carne pescado diverso producto alimenticios;Preparar con la carne y el pescado diversos productos alimenticios;c00000;c00000142
preparar certificar financiero presentarlo dirección accionista organismo público índole;Preparar y certificar estados financieros para presentarlos a la dirección a los accionistas y a los organismos públicos o de otra índole;c00005;c0000511
preparar contrato alquiler dado caso transferencia derecho propiedad;Preparar contratos de alquiler y dado el caso la transferencia de derechos de propiedad;c00000;c00000143
preparar declaracione informe financiero período determinados;Preparar declaraciones e informes financieros sobre períodos determinados;c00005;c0000512
preparar declaracione tributaria asesorar problema fiscale presentar alegato reclamacione fisco;Preparar declaraciones tributarias asesorar sobre problemas fiscales y presentar alegatos o reclamaciones ante el fisco;c02222;c0222263
preparar documento financiero calcular interese corretaje derecho timbre;Preparar documentos financieros y calcular intereses o corretajes y derechos de timbre;c00005;c0000513
preparar documento jurídicos;Preparar documentos jurídicos;c00005;c0000514
preparar documento resuman opinione jurídica jurisprudencia establezcan condicione préstamo seguros;Preparar documentos que resuman opiniones jurídicas o jurisprudencia o establezcan condiciones de préstamos o de seguros;c00005;c0000515
preparar estimacione detallada cantidade costo materiale mano obra necesario realización censo encuesta estadísticos;Preparar estimaciones detalladas de cantidades y costos de los materiales y mano de obra necesarios para la realización de censos y encuestas estadísticos;c00000;c00000144
preparar gráfico diagrama sistemático describir término lógico ordenamiento labore determinar secuencia proceder registro dato tratamiento computadora;Preparar gráficos y diagramas sistemáticos para describir en términos lógicos el ordenamiento de las labores y determinar en qué secuencias habrá que proceder al registro de datos y al tratamiento por computadora;c00011;c00011129
preparar informe escolare docentes;Preparar informes escolares o docentes;c00005;c0000516
preparar manuale información profesional u ocupacional sistema clasificación ocupaciones;Preparar manuales de información profesional u ocupacional o sistemas de clasificación de ocupaciones;c00144;c0014465
preparar ponencia informe carácter académico científico;Preparar ponencias e informes de carácter académico o científico;c00005;c0000517
preparar ponencia informe científicos;Preparar ponencias e informes científicos;c00005;c0000518
preparar presupuesto controlar operacione financieras;Preparar los presupuestos y controlar las operaciones financieras;c02222;c0222264
preparar tabaco fabricar cigarro puro cigarrillo producto . tarea pueden incluir supervisión trabajadore .;Preparar tabaco y fabricar cigarros puros cigarrillos y otros productos. sus tareas pueden incluir la supervisión de otros trabajadores.;c00000;c00000145
preparar verificar prueba imprenta;Preparar y verificar pruebas de imprenta;c00000;c00000146
presentar informe propietario si;Presentar informes a los propietarios si los hay;c00005;c0000519
presentar resultado operacione matemática estadística actua- riale gráfico cuadros;Presentar los resultados de operaciones matemáticas estadísticas o actua- riales en gráficos o cuadros;c00011;c00011130
prestación servicio jurídico sociale económico comerciale inclusive vinculado gestión empresas;La prestación de servicios jurídicos sociales económicos y comerciales inclusive los vinculados con la gestión de empresas;c00000;c00000147
prestación servicio técnico relacionado gestión empresa comercio finanza administración - inclusive refiere control cumplimiento cierta leye reglamento - protección asistencia sociales;La prestación de servicios técnicos relacionados con la gestión de empresas el comercio las finanzas la administración - inclusive en lo que se refiere al control del cumplimiento de ciertas leyes y reglamentos - y la protección y la asistencia sociales;c00000;c00000148
principale responsabilidade ma año experiencia posicion similar analisi requerimiento armado diseño funcional soporte mantenimiento evolutivo analisi incidente interactuar area usuarios;Principales responsabilidades  mas de  años de experiencia en una posicion similar analisis de requerimiento y armado del diseño funcional soporte mantenimiento evolutivo analisis de incidentes interactuar con areas usuarios;c00144;c0014466
proceder reajuste requieran acto asegurar funcionamiento correcto mecanismos;Proceder a los reajustes que se requieran en el acto para asegurar el funcionamiento correcto de los mecanismos;c00000;c00000149
proceso mecánico químico índole;Procesos mecánicos químicos o de otra índole;c00011;c00011131
procurando correcto funcionamiento sistema informatico seguridad informacion responsabilidade asegurar exito implementacion diferente proyecto desarrollo software monitorear cumplimiento proceso mantenimiento infraestructura supervisar correcta administracion base datos;Procurando el correcto funcionamiento de los sistemas informaticos y la seguridad de la informacion  responsabilidades  asegurar el exito e implementacion de los diferentes proyectos de desarrollo de software monitorear el cumplimiento de los procesos de mantenimiento a la infraestructura de ti supervisar la correcta administracion de las bases de datos;c00011;c00011132
profesional ingenieria sistema ingenieria industrial conocimiento herramienta ofimatica ( word excel power point outlook internet ) conocimiento procesamiento datos;Profesional en ingenieria de sistemas o ingenieria industrial conocimiento en herramientas ofimaticas (word excel power point outlook internet) conocimiento en procesamiento de datos;c00144;c0014467
programar reprogramar robot industriale funcione especiale capaces;Programar y reprogramar los robots industriales para las funciones especiales de que son capaces;c00011;c00011133
promover salud preparar ponencia informe científico . tarea pueden incluir supervisión trabajadores.\n\ncabe hacer observar cuenta índole tarea específica desempeñada grado responsabilidad entrañen requisito educativo exigencia formación distinto paíse acaso convenga clasificar ocupacione identificada subgrupo principal subgrupo principal 32 : técnico profesionale nivel medio ciencia biológica medicina salud . tale caso pueden darse especialmente respecto ocupacione clasificada subgrupo 223 : personal enfermería partería nivel superior .;Promover la salud y preparar ponencias e informes científicos. sus tareas pueden incluir la supervisión de otros trabajadores.\n\ncabe hacer observar que habida cuenta de la índole de las tareas específicas desempeñadas del grado de responsabilidad que entrañen y de los requisitos educativos y las exigencias de formación en distintos países acaso convenga clasificar algunas de las ocupaciones identificadas en este subgrupo principal en el subgrupo principal 32: técnicos y profesionales de nivel medio de las ciencias biológicas la medicina y la salud. tales casos pueden darse especialmente respecto de las ocupaciones clasificadas en el subgrupo 223: personal de enfermería y partería de nivel superior.;c00005;c0000520
promoviendo consistentemente conciencia hacia seguridad personal directo indirecto ganar conocimiento producto compañia diferente tecnologia empleada fabricacion procesamiento;Promoviendo consistentemente la conciencia hacia la seguridad en el personal directo e indirecto   ganar conocimiento de los productos de la compañia y las diferentes tecnologias empleadas en su fabricacion y procesamiento;c00000;c00000150
pronunciar sentencia dictámenes;Pronunciar sentencias o dictámenes;c00000;c00000151
proponer hacer fijar vigilar cumplimiento plazo fecha límite recordatorio periódicos;Proponer hacer fijar y vigilar el cumplimiento de plazos y fechas límites y de recordatorios periódicos;c00000;c00000152
proporcionar cliente presunto compradore información general técnica acerca característica funcionamiento material técnico venta demostrar utilización;Proporcionar a los clientes y presuntos compradores información general o técnica acerca de las características y funcionamiento del material técnico en venta y demostrar su utilización;c00000;c00000153
proyectar carrocería sistema suspensión freno elemento vehículo automóvile asesorar respecto;Proyectar carrocerías sistemas de suspensión frenos y otros elementos de vehículos automóviles y asesorar al respecto;c00011;c00011134
proyectar casco superestructura buque nave asesorar respecto;Proyectar cascos y superestructuras de buques y otras naves y asesorar al respecto;c00011;c00011135
proyectar dispositivo sistema motore equipo electrónico - ejemplo ordenadore equipo telecomunicacione - asesorar res- pecto;Proyectar dispositivos sistemas motores y equipos electrónicos - por ejemplo ordenadores o equipos de telecomunicaciones - y asesorar al res- pecto;c00011;c00011136
proyectar edificio preparar dibujo plano detallado construcción refección reconstrucción establecer mantener contacto necesario asegurar viabilidad proyecto cuanto atañe estilo costo plazo ejecución observancia norma reglamento pertinente cuestiones;Proyectar edificios preparar dibujos y planos detallados para su construcción refección o reconstrucción y establecer y mantener los contactos necesarios para asegurar la viabilidad de los proyectos en cuanto atañe a estilo costo plazos de ejecución observancia de normas y reglamentos pertinentes y otras cuestiones;c00011;c00011137
proyectar estructura - puente embalse muelle carretera aero- puerto vía férrea canale gasoducto oleoducto sistema eva- cuación desecho defensa inundacione edificio indus- triale grande edificacione - realizar trabajo investigación asesoramiento materia;Proyectar estructuras - puentes embalses muelles carreteras aero- puertos vías férreas canales gasoductos oleoductos sistemas de eva- cuación de desechos y de defensa contra inundaciones edificios indus- triales y otras grandes edificaciones - y realizar trabajos de investigación y asesoramiento en la materia;c00011;c00011138
proyectar fuselaje trene aterrizaje equipo aeronave asesorar respecto;Proyectar fuselajes trenes de aterrizaje y otros equipos para aeronaves y asesorar al respecto;c00011;c00011139
proyectar instalacione equipo mecánico producción control utilización energía nuclear asesorar respecto;Proyectar instalaciones y equipos mecánicos para la producción control y utilización de energía nuclear y asesorar al respecto;c00011;c00011140
proyectar máquina máquina herramienta industria manufactu- rera minera construcción fine industriale así agricultura asesorar respecto;Proyectar máquinas y máquinas herramientas para las industrias manufactu- rera minera y de la construcción y otros fines industriales así como para la agricultura y asesorar al respecto;c00011;c00011141
proyectar máquina vapor motore combustión interna máqui- na motore eléctrico utilizado propulsar locomotora ferrocarrile vehículo transporte carretera aeronave hacer funcionar instalacione industriale género dar asesoramiento pertinente;Proyectar máquinas de vapor motores de combustión interna y otras máqui- nas y motores no eléctricos utilizados para propulsar locomotoras de ferrocarriles vehículos de transporte por carretera y aeronaves o para hacer funcionar instalaciones industriales o de otro género y dar asesoramiento pertinente;c00011;c00011142
proyectar parte elemento salvo eléctrico electrónicos;Proyectar partes o elementos salvo los eléctricos o electrónicos;c00011;c00011143
proyectar realizar rede comunicación diferente instalacione informáticas;Proyectar y realizar redes de comunicación entre diferentes instalaciones informáticas;c00144;c0014468
proyectar sistema eléctrico motore tracción eléctrica equipo eléctrico aparato electrodoméstico asesorar respecto;Proyectar sistemas eléctricos para motores tracción eléctrica y otros equipos eléctricos o aparatos electrodomésticos y asesorar al respecto;c00011;c00011144
proyectar sistema equipo calefacción ventilación refrigeración asesorar respecto;Proyectar sistemas y equipos de calefacción ventilación y refrigeración y asesorar al respecto;c00011;c00011145
proyectar sistema producción transmisión distribución energía eléctrica asesorar respecto;Proyectar sistemas de producción transmisión y distribución de energía eléctrica y asesorar al respecto;c00011;c00011146
proyectar sistema propulsión buque centrale generadora energía sistema calefacción ventilación mecanismo gobierno dirección bomba equipo mecánico asesorar respecto;Proyectar sistemas de propulsión para buques centrales generadoras de energía sistemas de calefacción y ventilación mecanismos de gobierno y dirección bombas y otros equipos mecánicos y asesorar al respecto;c00011;c00011147
proyecto innovacion proyecto mejora proceso conocimiento avanzado m office project;Proyectos de innovacion o proyectos en mejora de procesos      conocimientos avanzados en ms office project;c00000;c00000154
pueden preparar sobre pago salario abonarlos;Pueden preparar los sobres de pago de salarios y abonarlos;c00000;c00000155
realizar amplia gama tarea oficinesca generale . tarea pueden incluir supervisión trabajadore .;Realizar una amplia gama de tareas oficinescas generales. sus tareas pueden incluir la supervisión de otros trabajadores.;c02222;c0222265
realizar cierto trabajo oficina escasa complejidad archivar sacar fotocopias;Realizar ciertos trabajos de oficina de escasa complejidad como archivar o sacar fotocopias;c00000;c00000156
realizar estudio servicio biblioteca información analizar modificar servicio prestado función necesidade usuarios;Realizar estudios sobre servicios de biblioteca e información y analizar y modificar los servicios prestados en función de las necesidades de los usuarios;c00000;c00000157
realizar experimento dispersión niebla lluvia artificial sistema modificar condicione meteorológicas;Realizar experimentos de dispersión de niebla lluvia artificial y otros sistemas para modificar las condiciones meteorológicas;c00011;c00011148
realizar investigacione acerca principio método informático incluido sistema comunicación tratamiento dato informa- ciones;Realizar investigaciones acerca de los principios y métodos informáticos incluidos los sistemas de comunicación y tratamiento de datos e informa- ciones;c00011;c00011149
realizar investigacione desarrollar método extracción metale minerale asesorar aplicación;Realizar investigaciones desarrollar métodos para la extracción de metales de sus minerales y asesorar sobre su aplicación;c00011;c00011150
realizar investigacione desarrollar perfeccionar teoría método relativo ingeniería civil obra públicas;Realizar investigaciones y desarrollar o perfeccionar teorías y métodos relativos a la ingeniería civil y a las obras públicas;c00011;c00011151
realizar investigacione estudio teoría principio derecho relacione leye reglamento jurisprudencia;Realizar investigaciones o estudios sobre teorías y principios del derecho y sus relaciones con las leyes y reglamentos y la jurisprudencia;c00011;c00011152
realizar investigacione financiera caso presunto fraude insolvencia quiebra índole semejante;Realizar investigaciones financieras en casos de presuntos fraudes insolvencia y quiebras o de índole semejante;c00000;c00000158
realizar investigacione perfeccionar concepto teoría método geología geofísica;Realizar investigaciones y perfeccionar los conceptos teorías y métodos de la geología y la geofísica;c00011;c00011153
realizar investigacione perfeccionar desarrollar concepto teoría método composición estructura dinámica atmósfera;Realizar investigaciones y perfeccionar o desarrollar los conceptos teorías y métodos sobre la composición estructura y dinámica de la atmósfera;c00011;c00011154
realizar investigacione perfeccionar desarrollar concepto teoría método química;Realizar investigaciones y perfeccionar o desarrollar los conceptos teorías y métodos de la química;c00011;c00011155
realizar investigacione perfeccionar desarrollar teoría técnica matemática actuariales;Realizar investigaciones y perfeccionar o desarrollar las teorías y técnicas matemáticas y actuariales;c00011;c00011156
realizar investigacione proyectar desarrollar perfeccionar método resolver problema técnico ingeniería mina extracción petróleo ga agua asesorar respecto;Realizar investigaciones y proyectar desarrollar o perfeccionar métodos para resolver problemas técnicos de la ingeniería de minas o de la extracción de petróleo gas o agua y asesorar al respecto;c00011;c00011157
realizar investigacione proyectar desarrollar procedimiento químico escala comercial refinar petróleo bruto líquido gase fabricar sustancia producto derivado petróleo explosivo producto alimenticio bebida medicamento materiale sintético asesorar respecto;Realizar investigaciones y proyectar y desarrollar procedimientos químicos a escala comercial para refinar petróleo bruto y otros líquidos o gases y fabricar sustancias y productos como derivados del petróleo explosivos productos alimenticios bebidas medicamentos o materiales sintéticos y asesorar al respecto;c00011;c00011158
realizar tarea administrativa bibliotecas;Realizar tareas administrativas en bibliotecas;c02222;c0222266
realizar tarea relacionada servicio correos;Realizar tareas relacionadas con los servicios de correos;c00000;c00000159
realizar tarea secretaría registrar computadorizar dato numérico inclusive contable financiero estadístico actuariales;Realizar tareas de secretaría registrar y computadorizar datos numéricos inclusive contables financieros estadísticos y actuariales;c02222;c0222267
realizar tarea técnica relacionada compilación dato operacione control calidad censo encuestas;Realizar tareas técnicas relacionadas con la compilación de datos y las operaciones de control de calidad en censos y encuestas;c02222;c0222268
realizar trabajo imprenta elaborar procesar producto comestible diverso artículo hecho madera materia textile cuero materiale . tarea pueden incluir supervisión trabajadore .;Realizar trabajos de imprenta y elaborar y procesar productos comestibles y diversos artículos hechos con madera materias textiles cuero y otros materiales. sus tareas pueden incluir la supervisión de otros trabajadores.;c02222;c0222269
recibir cliente brindarle información pertinente concertar entrevista nombre incluida requerida hospitale consultorio médico dentale atender centrale telefónica .;Recibir clientes brindarles la información pertinente y concertar entrevistas en su nombre incluidas las requeridas para hospitales y consultorios médicos y dentales y atender centrales telefónicas.;c00000;c00000160
recibir despachar correspondencia;Recibir y despachar correspondencia;c00000;c00000161
redactar acta detallada sesione parlamento tribunale cuerpo mediante taquigrafía estenotipia u método recoger transcribir textualmente intervenciones;Redactar actas detalladas de sesiones del parlamento de los tribunales o de otros cuerpos mediante la taquigrafía o la estenotipia u otros métodos para recoger y transcribir textualmente las intervenciones;c00005;c0000521
redactar anteproyecto leye reglamento fundado legislación;Redactar anteproyectos de leyes y reglamentos fundados en la legislación;c00005;c0000522
redactar carta comerciale técnica correspondencia mismo carácter responder mismas;Redactar cartas comerciales o técnicas y otra correspondencia del mismo carácter y responder a las mismas;c00005;c0000523
redactar correspondencia acta administrativas;Redactar correspondencia y actas administrativas;c00005;c0000524
redactar documento jurídico inclusive testamento contrato escritu- ras;Redactar documentos jurídicos inclusive testamentos contratos y escritu- ras;c00005;c0000525
redactar documento jurídicos;Redactar documentos jurídicos;c00005;c0000526
registrar debidamente transferencia título financiero biene inmuebles;Registrar debidamente transferencias de títulos financieros o de bienes inmuebles;c00011;c00011159
registrar documento transferencia propiedade título valore u asunto requieren registro oficial;Registrar documentos sobre transferencias de propiedades títulos y valores u otros asuntos que requieren registro oficial;c00011;c00011160
registrar mate- riale producción recibido almacenado entregados;Registrar los mate- riales de producción recibidos almacenados o entregados;c00011;c00011161
registrar transmitir órdene compraventa título accione obligacione u valore financiero inclusive divisa entrega futura inmediata;Registrar y transmitir órdenes de compraventa de títulos acciones obligaciones u otros valores financieros inclusive divisas para entrega futura o inmediata;c00011;c00011162
representar cliente primera instancia dar instruccione abogado aleguen nombre tribunale superiores;Representar a clientes en primera instancia o dar instrucciones a otros abogados para que aleguen en su nombre ante los tribunales superiores;c00000;c00000162
representar departamento cargo contacto demá sectore organización tercero . tarea pueden incluir supervisión trabajadore .;Representar al departamento a su cargo en los contactos con los demás sectores de la organización o con terceros. sus tareas pueden incluir la supervisión de otros trabajadores.;c00000;c00000163
representar departamento relacione trabajo depar- tamento empresa tercero i;Representar al departamento en sus relaciones de trabajo con otros depar- tamentos de la empresa o con terceros i;c00000;c00000164
representar departamento relacione trabajo depar- tamento empresa terceros;Representar al departamento en sus relaciones de trabajo con otros depar- tamentos de la empresa o con terceros;c00000;c00000165
representar departamento relacione trabajo departamento empresa terceros;Representar al departamento en sus relaciones de trabajo con otros departamentos de la empresa o con terceros;c00000;c00000166
representar organización trato tercero comprendido gobierno autoridade . tarea pueden incluir supervisión trabajadore .;Representar a la organización en su trato con terceros comprendidos el gobierno y otras autoridades. sus tareas pueden incluir la supervisión de otros trabajadores.;c00000;c00000167
representar paí extranjero;Representar a su país en el extranjero;c00000;c00000168
representar paí extranjero cumplir tarea similare organizacione intergubernamentale . tarea pueden incluir supervisión trabajadore .;Representar a su país en el extranjero y cumplir tareas similares en organizaciones intergubernamentales. sus tareas pueden incluir la supervisión de otros trabajadores.;c00000;c00000169
reservar bodega determinar flete percibir monto clientes;Reservar bodegas determinar fletes y percibir su monto de los clientes;c00000;c00000170
resolviendo problema mantenimiento;Resolviendo problemas de mantenimiento;c00000;c00000171
responsabilidade brindar soporte fomentar uso herramienta tecnologia empresa apoyar campaña asimilacion adopcion nueva tecnologia brindar soporte gestion integral gestion demanda;Responsabilidades  brindar soporte para fomentar el uso de las herramientas de tecnologia que tiene la empresa apoyar en campañas de asimilacion y adopcion de nuevas tecnologias brindar soporte a la gestion integral de ti gestion de la demanda;c00011;c00011163
