competencias;comp_original;parent_cod;cod
mantener contacto técnico celebrar consulta especialista pertinentes;Mantener contactos técnicos y celebrar consultas con otros especialistas pertinentes;c00000;c00000118
mantener mejorar sistema decision desarrollar enfoque innovadore efectivo resolver problema analitico comunicar resultado metodologia define implementa modelo descubrir patrone prediccione creando valor comercial innovacion capacidad traducir necesidade comerciale requisito tecnicos;Mantener y mejorar los sistemas de decision desarrollar enfoques innovadores y efectivos para resolver problemas analiticos y comunicar resultados y metodologias define e implementa modelos para descubrir patrones y predicciones creando valor comercial e innovacion capacidad para traducir las necesidades comerciales en requisitos tecnicos;c00011;c00011107
mantener vigor actualizar documentación programa instala- cione informáticos;Mantener en vigor y actualizar la documentación sobre programas e instala- ciones informáticos;c00011;c00011108
mantenimiento desarrollar mantener actualizado plan integral implementacion eagle monitorear progreso nivel madurez hacia organizacion clase mundial estandarizacion diseñar;Y mantenimiento   desarrollar y mantener actualizado el plan integral de implementacion de eagle para monitorear el progreso del nivel de madurez hacia una organizacion de clase mundial  estandarizacion   diseñar;c00011;c00011109
mantenimiento infraestructura;Mantenimiento de infraestructura;c02222;c0222221
materia ciencia biológica disciplina conexa incluida medicina materia ciencia sociale humanidade . tarea abarcan ejemplo enseñanza primaria preescolar;En materia de ciencias biológicas y disciplinas conexas incluida la medicina y en materia de ciencias sociales y humanidades. otras tareas abarcan por ejemplo la enseñanza primaria y preescolar;c00000;c00000119
materia ciencia biológica disciplina conexa incluida medicina materia ciencia sociale humanidade arte religión;En materia de ciencias biológicas y disciplinas conexas incluida la medicina y en materia de ciencias sociales humanidades artes y religión;c00000;c00000120
medio implementacion herramienta tecnologia optimizar proceso funcionamiento negocio responsabilidade clave identificar requerimiento necesidade cliente promoviendo venta servicio mercado;Por medio de la implementacion de herramientas tecnologias para optimizar el proceso y funcionamiento del negocio  tus responsabilidades clave  identificar requerimientos y necesidades de clientes promoviendo la venta de servicios al mercado;c00144;c0014457
metodologia informacion show more;Metodologias e informacion show more ;c00144;c0014458
metodologia scrum;Metodologia scrum;c00000;c00000121
moldear cortar soldar metales;Moldear cortar y soldar metales;c00000;c00000122
monitoreando desempeño cumplimiento contrato acuerdo documentando problema critico servicio corrigiendo segun corresponda planeacion control presupuesto it contemplando rubro depreciacion amortizacion hardware software acuerdo licenciamiento software mantenimiento hardware software rentacompra hardware compra consumible it telecomunicacione rede honorario servicio especializado it creacion equipo alto rendimiento promoviendo compromiso colaboradore proveer claridad estrategias;Monitoreando el desempeño en cumplimiento de contratos y acuerdos documentando problemas criticos de servicio y corrigiendo segun corresponda   planeacion y control de presupuesto de it contemplando los rubros de   depreciacion y amortizacion de hardware y software acuerdos de licenciamiento de software mantenimiento de hardware y software rentacompra de hardware compra de consumibles de it telecomunicaciones y redes honorarios de servicios especializados de it   creacion de equipos de alto rendimiento   promoviendo el compromiso de los colaboradores al proveer claridad en las estrategias;c00000;c00000123
montar cinta disco magnético medida hace falta tratar registrar información digital encargarse cuidar biblioteca disco cinta d;Montar las cintas y discos magnéticos a medida que hace falta para tratar o registrar información digital y encargarse de cuidar la biblioteca de discos y cintas d;c00011;c00011110
necesitamo contar mejore profesionale area grupo ei buscamo proximo ingeniero proyecto apoyara diferente proyecto ligado diseño calculo estructura hormigon armadoque cosa esperamo alta orientacion cumplimiento objetivo experiencia diseño calculo estructura hormigon armado posea correcto manejo norma diseño estructural aci nch;Necesitamos contar con los mejores profesionales del area desde el grupo ei buscamos a nuestro proximo ingeniero de proyectos quien nos apoyara nuestros diferentes proyectos ligados al diseño y calculo de estructuras de hormigon armadoque cosas esperamos de ti que tengas una alta orientacion al cumplimiento de objetivos que tengas experiencia en diseño y calculo de estructuras de hormigon armado  que poseas un correcto manejo de normas de diseño estructural aci y nch;c00000;c00000124
negociar abastecedore cliente así empresas;Negociar con los abastecedores y los clientes así como con otras empresas;c00000;c00000125
negociar abastecedore cliente así empresas;Negociar con los abastecedores y clientes así como con otras empresas;c00000;c00000126
negociar cliente determinar tipo nivele riesgo alcance cobertura condicione pago;Negociar con los clientes para determinar los tipos y niveles del riesgo el alcance de la cobertura y las condiciones de pago;c00000;c00000127
negociar contratarla compra equipo materia prima producto suministro fábrica servicio utilidad pública servicio estatale u establecimiento comprar mercancía revenderlas;Negociar y contratarla compra de equipos materias primas productos y suministros para fábricas servicios de utilidad pública servicios estatales u otros establecimientos o comprar mercancías para la revenderlas;c00000;c00000128
negociar contrato publicidad representante periódico estacione radio televisión organizacione deportiva culturale agencia publicidad;Negociar contratos de publicidad con los representantes de periódicos estaciones de radio y televisión organizaciones deportivas y culturales y agencias de publicidad;c00000;c00000129
negociar establecer póliza reaseguro;Negociar y establecer pólizas de reaseguro;c00000;c00000130
negociar operacione compra venta particular mercado participar subasta pertinentes;Negociar operaciones de compra o venta particular fuera de los mercados o sin participar en las subastas pertinentes;c00000;c00000131
normativa control calidad proyecto tecnologia informacion telecomunicacione estandare calidad metodologia metodologia gestion proyecto gestion servicio tic ofrecemo orientacion objetivo reconocimiento trabajo plan inmersion plan formacion base objetivo compañia necesidade persona crecimiento profesional mejora continua cultura promocion interna equipo programa incentivo laborale beneficio empresa formar parte equipo persona dinamicas;Normativas y control de calidad en proyectos de tecnologias de la informacion yo telecomunicaciones   estandares de calidad y metodologias   metodologias de gestion de proyectos y de gestion de servicios tic     ofrecemos      orientacion a objetivos y reconocimiento al trabajo   plan de inmersion y plan de formacion en base a los objetivos de la compañia y las necesidades de la persona   crecimiento profesional y mejora continua   cultura de promocion interna de nuestro equipo   programa de incentivos laborales y beneficios de empresa   formar parte de un equipo de personas dinamicas;c00144;c0014459
notacion proceso bpmn;Notacion de procesos bpmn;c00000;c00000132
obtener compilar computadorizar dato estadístico actuariales;Obtener compilar y computadorizar datos estadísticos o actuariales;c00011;c00011111
obtener compilar dato estadístico actuariale partiendo fuente información ordinaria especiales;Obtener y compilar datos estadísticos o actuariales partiendo de fuentes de información ordinarias o especiales;c00011;c00011112
obtener informacione antecedente cliente necesa- ria determinar tipo condicione seguro apropiados;Obtener las informaciones sobre los antecedentes de los clientes necesa- rias para determinar tipos y condiciones del seguro apropiados;c00000;c00000133
obtener informacione propiedade venta alquiler acerca necesidade eventuale compradore arrendatarios;Obtener informaciones sobre las propiedades en venta o en alquiler y acerca de las necesidades de los eventuales compradores o arrendatarios;c00000;c00000134
obtener informacione situación financiera cliente empresa pudiera invertirse;Obtener informaciones sobre la situación financiera de los clientes o de las empresas en que pudiera invertirse;c00000;c00000135
obtener información necesidade existencia materiale determinar cantidad calidad costo debe comprar fecha entrega condicione contratos;Obtener información sobre necesidades y existencias de materiales y determinar la cantidad calidad y costos de lo que se debe comprar las fechas de entrega y otras condiciones de los contratos;c00000;c00000136
obtener órdene compra vender biene servicio establecimiento industriale empresa minorista mayorista índole;Obtener órdenes de compra y vender bienes y servicios a establecimientos industriales y empresas minoristas o mayoristas o de otra índole;c00000;c00000137
operacion mantenimiento rede transmision energia electrica alta tension rep gestiona do importante empresa sector consorcio transmantaro isa peru tre empresa interconexion electrica sa isa cuentan red subestacione electrica mas;Operacion y mantenimiento de redes de transmision de energia electrica en alta tension rep gestiona a dos importantes empresas del sector consorcio transmantaro e isa peru las tres son empresas de interconexion electrica sa isa y cuentan con una red de subestaciones electricas y mas de ;c00144;c0014460
operar máquina tratamiento texto calculadora copiadora contable máquina oficina similares;Operar máquinas de tratamiento de textos calculadoras copiadoras contables y otras máquinas de oficina similares;c00011;c00011113
organizar actividade educativa preparar informe escolare docente . tarea pueden incluir supervisión trabajadore .;Organizar algunas actividades educativas y preparar informes escolares o docentes. sus tareas pueden incluir la supervisión de otros trabajadores.;c00005;c0000510
organizar administrar servicio préstamo rede información disposición usuarios;Organizar y administrar servicios de préstamo y redes de información a disposición de los usuarios;c00000;c00000138
organizar ampliar conservar coleccione interé valor artístico cultural científico histórico museo galería ar-te;Organizar ampliar y conservar colecciones de interés o valor artístico cultural científico o histórico en museos o galerías de ar-te;c00011;c00011114
organizar ampliar conservar sistemáticamente colección libro revista informe obra disponible forma impresa forma audiovisual;Organizar ampliar y conservar sistemáticamente una colección de libros revistas informes y otras obras disponibles en forma impresa o en forma audiovisual;c00011;c00011115
organizar clasificar catalogar material reunido bibliotecas;Organizar clasificar y catalogar el material reunido en las bibliotecas;c00011;c00011116
organizar dirigir conservación refección estructura existentes;Organizar y dirigir la conservación y refección de las estructuras existentes;c02222;c0222222
organizar dirigir mantenimiento reparación equipos;Organizar y dirigir el mantenimiento y reparación de equipos;c02222;c0222223
organizar dirigir mantenimiento reparación máquina mecanismo herramienta motore dispositivo instalacione equipo industriales;Organizar y dirigir el mantenimiento y reparación de máquinas mecanismos herramientas motores dispositivos instalaciones y equipos industriales;c02222;c0222224
organizar dirigir mantenimiento reparación sistema motore equipo electrónicos;Organizar y dirigir el mantenimiento y reparación de sistemas motores y equipos electrónicos;c02222;c0222225
organizar dirigir mantenimiento reparación sistema motore equipo eléctricos;Organizar y dirigir el mantenimiento y reparación de sistemas motores y equipos eléctricos;c02222;c0222226
organizar efectuar tarea clasificación distribución correspondencia interna servicio correos;Organizar y efectuar tareas de clasificación y distribución de correspondencia interna o en los servicios de correos;c00011;c00011117
organizar llevar registro viaje brindar información cliente concertar entrevista u operar servicio telefónico . tarea pueden incluir supervisión trabajadore .;Organizar y llevar registros de viajes brindar información a los clientes y concertar entrevistas u operar un servicio telefónico. sus tareas pueden incluir la supervisión de otros trabajadores.;c00011;c00011118
organizar operacione serie tratamiento dato garantizar ejecución correcta eficiente tiempo oportuno;Organizar operaciones en serie de tratamiento de datos para garantizar su ejecución correcta y eficiente en tiempo oportuno;c00011;c00011119
organizar operacione serie tratamiento datos;Organizar operaciones en serie de tratamiento de datos;c00011;c00011120
organizar producción lista catálogo venta subasta fijar precio mínimo subasta licitar representación cliente mercado entrega inmediata futuros;Organizar la producción de listas y catálogos de venta o subasta fijar precios mínimos de subasta y licitar en representación de los clientes en los mercados de entrega inmediata o futuros;c00011;c00011121
organizar supervisar sistema archivo;Organizar y supervisar los sistemas de archivo;c02222;c0222227
organizar tale coleccione exhibirla museo institucione establecimiento similares;Organizar tales colecciones y exhibirlas en museos e instituciones y establecimientos similares;c00011;c00011122
organizar vender servicio turismo asegurar respecto;Organizar y vender servicios de turismo y asegurar al respecto;c00000;c00000139
organizar viaje colectivo negocio vacacione venderlo grupo personas;Organizar viajes colectivos de negocios o vacaciones y venderlos a grupos o a personas;c00000;c00000140
owap audit pentest ( infraestructuraaplicacione ) seguridad defensiva bloe team herramienta seguridad ( nmap msf arachni burp ) responsabilidade contribuir gerente elaboracion programa trabajo auditoria ejecutar;Owap audit pentest (infraestructuraaplicaciones) seguridad defensiva y bloe team herramientas de seguridad (nmap msf arachni burp)     responsabilidades  contribuir con el gerente en la elaboracion del programa de trabajo de las auditorias a ejecutar;c00144;c0014461
perfeccionar desarrollar teoría método arquitectónicos;Perfeccionar o desarrollar teorías y métodos arquitectónicos;c00011;c00011123
pilotar aeronave dirigir navegación buque embarcacione inspeccionar cumplimiento reglamento seguridad construccione proceso equipo producto . pueden recibir orientación personal directivo administración pública directore empresa profesionale científico intelectuale . tarea pueden incluir supervisión trabajadore .;Pilotar aeronaves o dirigir la navegación de buques y otras embarcaciones e inspeccionar el cumplimiento de reglamentos de seguridad en construcciones procesos equipos y productos. pueden recibir orientación del personal directivo de la administración pública de directores de empresa o de profesionales científicos e intelectuales. sus tareas pueden incluir la supervisión de otros trabajadores.;c00011;c00011124
planificación proyección producción control arquitectura computadoras;La planificación la proyección la producción y el control de la arquitectura de las computadoras;c00144;c0014462
planificar aplicar programa información destinado autoridade medio comunicación masa público general plane logro opinione empresa u organización;Planificar y aplicar los programas de información destinados a las autoridades los medios de comunicación de masas y al público en general sobre los planes logros y opiniones de la empresa u organización;c02222;c0222228
planificar aplicar programa venta comercialización basado venta evaluación mercado;Planificar y aplicar programas de venta y comercialización basados en el estado de las ventas y la evaluación del mercado;c02222;c0222229
planificar controlar utilización recurso selección personal;Planificar y controlar la utilización de los recursos y la selección del personal;c00011;c00011125
planificar dirigir actividade recaudación fondo realizada cuenta organizacione educacionale humanitaria organizacione fine lucrativos;Planificar y dirigir las actividades de recaudación de fondos realizadas por cuenta de organizaciones educacionales humanitarias y otras organizaciones sin fines lucrativos;c02222;c0222230
planificar dirigir almacenamiento tratamiento inicial transporte agua petróleo gas;Planificar y dirigir el almacenamiento tratamiento inicial y transporte de agua petróleo o gas;c02222;c0222231
planificar dirigir coordinar actividade comerciale empresa;Planificar dirigir y coordinar las actividades comerciales de la empresa;c02222;c0222232
planificar dirigir coordinar actividade empresa u organismo conjunto departamento servicio . tarea pueden incluir supervisión trabajadore .;Planificar dirigir y coordinar las actividades de la empresa u organismo en su conjunto o de uno de sus departamentos o servicios. sus tareas pueden incluir la supervisión de otros trabajadores.;c02222;c0222233
planificar dirigir coordinar actividade enseñanza pública privada;Planificar dirigir y coordinar actividades de la enseñanza pública o privada;c02222;c0222234
planificar dirigir coordinar actividade investigación desarrollo propia empresa u organización confiada organizacione investigación fin crear nuevo procedimiento producto modo utilización materiale nuevo perfeccionados;Planificar dirigir y coordinar las actividades de investigación y desarrollo tanto las de la propia empresa u organización como las confiadas a otras organizaciones de investigación a fin de crear nuevos procedimientos y productos o modos de utilización de materiales nuevos o perfeccionados;c02222;c0222235
planificar dirigir coordinar actividade prestación servicio empresa tale servicio banca seguro gestión inmobiliaria procesamiento dato estudio mercado contabilidad arquitectura ingeniería limpieza edificio pericia análisi técnico publicidad embalaje mercancía : b;Planificar dirigir y coordinar las actividades de prestación de servicios a empresas tales como servicios de banca seguro gestión inmobiliaria procesamiento de datos estudio de mercados contabilidad arquitectura ingeniería limpieza de edificios pericias y análisis técnicos publicidad o embalaje de mercancías: b;c02222;c0222236
planificar dirigir coordinar actividade producción biene extracción minerale sólido mina subterránea superficie cantera producción distribución electricidad ga agua;Planificar dirigir y coordinar las actividades de producción de bienes o la extracción de minerales sólidos de minas subterráneas de superficie y de canteras o la producción y distribución de electricidad gas y agua;c02222;c0222237
planificar dirigir coordinar actividade producción bienes;Planificar dirigir y coordinar las actividades de producción de bienes;c02222;c0222238
planificar dirigir coordinar actividade publicidad relacione pública empresa u organización;Planificar dirigir y coordinar las actividades de publicidad y relaciones públicas de la empresa u organización;c02222;c0222239
planificar dirigir coordinar actividade relacionada administración funcionamiento asunto exteriore orden público seguridad;Planificar dirigir y coordinar actividades relacionadas con la administración y el funcionamiento de los asuntos exteriores el orden público y la seguridad;c02222;c0222240
planificar dirigir coordinar actividade relacionada administración funcionamiento sistema seguridad social financiado fondo erario público;Planificar dirigir y coordinar actividades relacionadas con la administración y el funcionamiento de los sistemas de seguridad social financiados por fondos del erario público;c02222;c0222241
planificar dirigir coordinar actividade relacionada manifestacione servicio recreativo culturale deportivos;Planificar dirigir y coordinar actividades relacionadas con manifestaciones y servicios recreativos culturales y deportivos;c02222;c0222242
planificar dirigir coordinar actividade relacionada operacione institucione organismo extraterritoriales;Planificar dirigir y coordinar actividades relacionadas con las operaciones de instituciones y organismos extraterritoriales;c02222;c0222243
planificar dirigir coordinar actividade relacionada servicio sanidad asistencia social;Planificar dirigir y coordinar actividades relacionadas con los servicios de sanidad y de asistencia social;c02222;c0222244
planificar dirigir coordinar actividade relativa construcción edificio obra públicas;Planificar dirigir y coordinar las actividades relativas a la construcción de edificios y a las obras públicas;c02222;c0222245
planificar dirigir coordinar actividade servicio hostelería restauración servicio conexos;Planificar dirigir y coordinar las actividades de servicio de la hostelería la restauración y otros servicios conexos;c02222;c0222246
planificar dirigir coordinar actividade servicio relacionada transporte almacenamiento comunicaciones;Planificar dirigir y coordinar las actividades de servicio relacionadas con los transportes el almacenamiento y las comunicaciones;c02222;c0222247
planificar dirigir coordinar funcionamiento general asistencia meno do directore habitualmente siguiendo orientación impartida directorio u órgano directivo;Planificar dirigir y coordinar su funcionamiento general con la asistencia de por lo menos otros dos directores habitualmente siguiendo la orientación impartida por un directorio u otro órgano directivo;c02222;c0222248
planificar dirigir coordinar operacione financiera administración interna empresa u organización;Planificar dirigir y coordinar las operaciones financieras y la administración interna de la empresa u organización;c02222;c0222249
planificar dirigir coordinar operacione relacionada servicio público ejemplo sistema atribución crédito sistema impositivo aplicación reglamentación oficial materia comercial así administración servicio público actividade similares;Planificar dirigir y coordinar operaciones relacionadas con el servicio público por ejemplo sistemas de atribución de créditos o sistemas impositivos aplicación de la reglamentación oficial en materia comercial así como la administración del servicio público y otras actividades similares;c02222;c0222250
planificar dirigir coordinar operacione venta comercialización empresa u organización;Planificar dirigir y coordinar las operaciones de venta y comercialización de la empresa u organización;c02222;c0222251
planificar dirigir coordinar organización campaña publicitaria asesorar respecto;Planificar o dirigir y coordinar la organización de campañas publicitarias y asesorar al respecto;c02222;c0222252
planificar dirigir coordinar política empresa u organización relativo personal relacione laborales;Planificar dirigir y coordinar a política de la empresa u organización en todo lo relativo al personal y a las relaciones laborales;c02222;c0222253
planificar dirigir operacione comerciale diarias;Planificar y dirigir las operaciones comerciales diarias;c02222;c0222254
planificar dirigir operacione diaria prestación servicios;Planificar y dirigir las operaciones diarias de prestación de servicios;c02222;c0222255
planificar dirigir operacione producción diaria;Planificar y dirigir las operaciones de la producción diaria;c02222;c0222256
planificar dirigir trabajo diario;Planificar y dirigir el trabajo diario;c02222;c0222257
planificar efectuar reconocimiento topográfico mediante fotografía aéreas;Planificar y efectuar reconocimientos topográficos mediante fotografías aéreas;c00011;c00011126
planificar implantar política sistema presupuestario control cuenta similare asesorar respecto;Planificar e implantar políticas y sistemas presupuestarios de control y de cuentas y similares y asesorar al respecto;c02222;c0222258
planificar organizar procedimiento destinado contratación formación promoción fijación escala salarial negociacione salario comunicación consulta trabajadore demá cuestione relacionada personal empresa u organización;Planificar y organizar los procedimientos destinados a la contratación formación promoción fijación de la escala salarial y las negociaciones sobre salarios comunicación y consulta a los trabajadores y demás cuestiones relacionadas con el personal de la empresa u organización;c02222;c0222259
planificar preparar censo encuesta recopilar dato estadísticos;Planificar y preparar censos y encuestas y recopilar datos estadísticos;c00011;c00011127
planificar programa general investigación desarrollo empresa u organización definir meta proyecto fijar presupuestos;Planificar el programa general de investigación y desarrollo de la empresa u organización definir las metas de los proyectos y fijar sus presupuestos;c02222;c0222260
planificar proyectar ordenación terreno destinado parque escuela institucione aeropuerto carretera zona comerciale industriale residenciales;Planificar y proyectar la ordenación de terrenos destinados a parques escuelas instituciones aeropuertos carreteras y zonas comerciales industriales y residenciales;c02222;c0222261
planificar trazado control circulación carretera vía tránsito fin elevar eficacia seguridad asesorar ello;Planificar el trazado y control de la circulación en carreteras y otras vías de tránsito a fin de elevar su eficacia y seguridad y asesorar sobre ello;c00011;c00011128
