title_clean;link;description;desc;list_compe
analista sistemas;5;Recopilar información del usuario, aclarando interpretaciones y manejando expectativas. Analizar requerimientos, diseñar y especificar funcionalmente la solución propuesta en base al conocimiento adquirido Generar documentos y graficar procesos en base a lo relevado. Elaboración y ejecución de pruebas funcionales. Requisitos  Bachiller o titulado en Ingeniería de Sistemas, Software, Informática, Industrial o profesiones afines tres (03) años desempeñando el cargo de Analista de Sistemas o Analista Funcional o Analista Técnico en el sector financiero. Conocimiento en toma de requerimiento y análisis. Beneficios  Sueldo acorde al mercado. Pagos mensuales y puntuales. Oportunidad de línea de carrera horizontal o vertical. Capacitaciones constantes. Oportunidad de trabajar con importantes empresas internacionales de los rubros banca, telco, retail, etc. Actividades de integración online EPS (opcional)  MDP cree en la igualdad de oportunidades para mujeres y hombres, por ello, promovemos la diversidad de generaciones, origen, nacionalidad e inclusión de personas con habilidades diferentes y/o discapacidad (de acuerdo con la Ley 29973).  ¿Te encuentras interesado en ser parte de nuestro equipo? ¡Postula con nosotros! Sé parte de nuestro equipo, porque en MDP ¡Lo hacemos diferente!  En MDP Consulting, importante consultora de tecnología de la información con más de 10 años de experiencia en el rubro, certificada en CMMI Nivel 3, TMMI Nivel 3 e ISO-9001 2008, nos encontramos en búsqueda del mejor talento, para nuestra vacante de  Analista de Sistemas Show more ;recopilar informacion del usuario, aclarando interpretaciones y manejando expectativas analizar requerimientos, diseñar y especificar funcionalmente la solucion propuesta en base al conocimiento adquirido generar documentos y graficar procesos en base a lo relevado elaboracion y ejecucion de pruebas funcionales requisitos  bachiller o titulado en ingenieria de sistemas, software, informatica, industrial o profesiones afines tres () años desempeñando el cargo de analista de sistemas o analista funcional o analista tecnico en el sector financiero conocimiento en toma de requerimiento y analisis beneficios  sueldo acorde al mercado pagos mensuales y puntuales oportunidad de linea de carrera horizontal o vertical capacitaciones constantes oportunidad de trabajar con importantes empresas internacionales de los rubros banca, telco, retail, etc actividades de integracion online eps (opcional)  mdp cree en la igualdad de oportunidades para mujeres y hombres, por ello, promovemos la diversidad de generaciones, origen, nacionalidad e inclusion de personas con habilidades diferentes yo discapacidad (de acuerdo con la ley )  te encuentras interesado en ser parte de nuestro equipo postula con nosotros se parte de nuestro equipo, porque en mdp lo hacemos diferente  en mdp consulting, importante consultora de tecnologia de la informacion con mas de  años de experiencia en el rubro, certificada en cmmi nivel , tmmi nivel  e iso , nos encontramos en busqueda del mejor talento, para nuestra vacante de  analista de sistemas show more ;['diseñar y especificar funcionalmente la solucion propuesta en base al conocimiento adquirido generar documentos y graficar procesos en base a lo relevado elaboracion y ejecucion de pruebas funcionales requisitos  bachiller o titulado en ingenieria de sistemas', 'industrial o profesiones afines tres () años desempeñando el cargo de analista de sistemas o analista funcional o analista tecnico en el sector financiero conocimiento en toma de requerimiento y analisis beneficios  sueldo acorde al mercado pagos mensuales y puntuales oportunidad de linea de carrera horizontal o vertical capacitaciones constantes oportunidad de trabajar con importantes empresas internacionales de los rubros banca']
administrador base datos;5;Responsable de la administración de bases de datos, administrar tecnología de la información y comunicación así como de la gestión de servidores.;responsable de la administracion de bases de datos, administrar tecnologia de la informacion y comunicacion asi como de la gestion de servidores;[]
analista tecnologia informacion;5;Principales funciones  Velar por el correcto funcionamiento de la plataforma de servidores de AES de acuerdo con los procedimientos establecidos para la administración de la misma. Es responsable de la aplicación de las políticas de ciberseguridad Responsable del análisis, corrección con causa raíz de los incidentes asociados a las aplicaciones AES Responsable de realizar optimizaciones de procesos de las aplicaciones de MCAC. Optimizar soluciones tecnológicas en base a necesidades y oportunidades de mejora funcionales. Participar en proyectos tecnológicos con proveedores;principales funciones  velar por el correcto funcionamiento de la plataforma de servidores de aes de acuerdo con los procedimientos establecidos para la administracion de la misma es responsable de la aplicacion de las politicas de ciberseguridad responsable del analisis, correccion con causa raiz de los incidentes asociados a las aplicaciones aes responsable de realizar optimizaciones de procesos de las aplicaciones de mcac optimizar soluciones tecnologicas en base a necesidades y oportunidades de mejora funcionales participar en proyectos tecnologicos con proveedores;[]
auxiliar tecnologia informacion;5;Funciones Principales  Mantenimiento y reparación de computadoras / Laptops. Conocimiento sobre configuracion de redes lan, wifi basico. Conocimiento de ITIL 4 mesa de ayuda Instalacón de equipos de sonido y multimedia Conocimiento de ofimatic, cubicol, soporte de sistemas.   Requisitos   Grado de Insrtucción Técnico en Computación  Experiencia 2 años como técnico en computación deseable rubro educativo.  Beneficios  Ingreso a Planilla desde el primer dia.  Beneficios de ley vacaciones,cts.  Convenios coporativos con las Instituciones Agustinas ( Colegios, Instituto)  Seguro de Vida Ley.  Harios de lunes a viernes de 8 00 a 5 pm y disposicion a laborar algunos sabado.  Somos una orden religiosa con más de 100 años en el Perú, nuestro compromiso es la evangelizacion en nuestros colegios, parroquias, e iniciativas pastorales, viviendo el carisma agustino. Actualmente somos más de 800 colaboradores en nuestras instituciones a nivel nacional. Show more ;funciones principales  mantenimiento y reparacion de computadoras  laptops conocimiento sobre configuracion de redes lan, wifi basico conocimiento de itil  mesa de ayuda instalacon de equipos de sonido y multimedia conocimiento de ofimatic, cubicol, soporte de sistemas   requisitos   grado de insrtuccion tecnico en computacion  experiencia  años como tecnico en computacion deseable rubro educativo  beneficios  ingreso a planilla desde el primer dia  beneficios de ley vacaciones,cts  convenios coporativos con las instituciones agustinas ( colegios, instituto)  seguro de vida ley  harios de lunes a viernes de   a  pm y disposicion a laborar algunos sabado  somos una orden religiosa con mas de  años en el peru, nuestro compromiso es la evangelizacion en nuestros colegios, parroquias, e iniciativas pastorales, viviendo el carisma agustino actualmente somos mas de  colaboradores en nuestras instituciones a nivel nacional show more ;['funciones principales  mantenimiento y reparacion de computadoras  laptops conocimiento sobre configuracion de redes lan', 'wifi basico conocimiento de itil  mesa de ayuda instalacon de equipos de sonido y multimedia conocimiento de ofimatic']
analista financiero;4;“Cuidar de las personas y empresas para hacer del mundo un lugar más seguro, manteniéndonos a la vanguardia de la innovación” es lo que nos motiva desde hace más de 40 años.  Y lo hacemos utilizando las tecnologías más punteras (IA, IoT, Data Science, Blockchain, etc.) para ofrecer soluciones disruptivas a través de nuestras cinco líneas de negocio: Security, Cash, Alarms, CIPHER y AVOS.  Como un verdadero equipo, nuestros más de 150.000 profesionales han conseguido posicionarnos como un referente a nivel global en el sector de la seguridad privada estando presentes en más de 25 países.  La innovación y la capacidad para transformarnos forman parte de nuestro ADN y compartimos tres valores que nos caracterizan: Nos importan las personas, pensamos en positivo y somos imparables.  ¿Y tú? ¿Te sientes identificado con nuestro propósito? ¿Te apasionan los retos y quieres llevar tu carrera profesional a otro nivel? Hoy tienes la oportunidad de hacerlo sumándote a nuestro Team of Teams en el área ingeniería de Sisitemas electrónicos de Seguridad como Administrativo Técnico Comercial.     ¿Cuáles van a ser tus funciones y responsabilidades?  Administración y optimización de los recursos con que cuenta la empresa. Análisis de servicios prestados y elaboración de facturas electrónicas para clientes.  · Análisis e interpretación de información financiera, conciliaciones de cuentas de balance y resultados, preparación de reportes e indicadores financieros y operativos.  · Apoyo en la elaboración de presupuestos y análisis de variaciones vs real.  · Elaboración de hojas de cálculo, Excel y análisis de bases de datos.  · Revisión de servicios a facturar y nómina.  ¿Qué buscamos de ti?  · Licenciatura Concluida en Contabilidad, Finanzas.  · Experiencia en labores Contables-Financieras.  · Valorable la experiencia de más de 3 años con áreas contables.  · Conocimientos altos del paquete Office y en concreto de Excel.  ¿Qué te ofrecemos?  · Contrato indefinido  · Trabajar en un entorno dinámico con un excelente ambiente laboral  · Acceder a un plan formativo de primer nivel gracias a la Universidad Corporativa de Prosegur  · Disponer de teletrabajo  · Prestaciones superiores a la Ley  · Disfrutar de nuestro Programa Global de Bienestar  Si quieres convertirte en un auténtico Prosegurer, ¡aplica a esta vacante para comenzar tu aventura con nosotros! Estamos deseando conocerte.  Envía cv a guadalupe.olivera@prosegur.com  Show more ;cuidar de las personas y empresas para hacer del mundo un lugar mas seguro, manteniendonos a la vanguardia de la innovacion es lo que nos motiva desde hace mas de  años  y lo hacemos utilizando las tecnologias mas punteras (ia, iot, data science, blockchain, etc) para ofrecer soluciones disruptivas a traves de nuestras cinco lineas de negocio security, cash, alarms, cipher y avos  como un verdadero equipo, nuestros mas de  profesionales han conseguido posicionarnos como un referente a nivel global en el sector de la seguridad privada estando presentes en mas de  paises  la innovacion y la capacidad para transformarnos forman parte de nuestro adn y compartimos tres valores que nos caracterizan nos importan las personas, pensamos en positivo y somos imparables  y tu te sientes identificado con nuestro proposito te apasionan los retos y quieres llevar tu carrera profesional a otro nivel hoy tienes la oportunidad de hacerlo sumandote a nuestro team of teams en el area ingenieria de sisitemas electronicos de seguridad como administrativo tecnico comercial     cuales van a ser tus funciones y responsabilidades  administracion y optimizacion de los recursos con que cuenta la empresa analisis de servicios prestados y elaboracion de facturas electronicas para clientes   analisis e interpretacion de informacion financiera, conciliaciones de cuentas de balance y resultados, preparacion de reportes e indicadores financieros y operativos   apoyo en la elaboracion de presupuestos y analisis de variaciones vs real   elaboracion de hojas de calculo, excel y analisis de bases de datos   revision de servicios a facturar y nomina  que buscamos de ti   licenciatura concluida en contabilidad, finanzas   experiencia en labores contablesfinancieras   valorable la experiencia de mas de  años con areas contables   conocimientos altos del paquete office y en concreto de excel  que te ofrecemos   contrato indefinido   trabajar en un entorno dinamico con un excelente ambiente laboral   acceder a un plan formativo de primer nivel gracias a la universidad corporativa de prosegur   disponer de teletrabajo   prestaciones superiores a la ley   disfrutar de nuestro programa global de bienestar  si quieres convertirte en un autentico prosegurer, aplica a esta vacante para comenzar tu aventura con nosotros estamos deseando conocerte  envia cv a guadalupeoliveraprosegurcom  show more ;['finanzas   experiencia en labores contablesfinancieras   valorable la experiencia de mas de  años con areas contables   conocimientos altos del paquete office y en concreto de excel  que te ofrecemos   contrato indefinido   trabajar en un entorno dinamico con un excelente ambiente laboral   acceder a un plan formativo de primer nivel gracias a la universidad corporativa de prosegur   disponer de teletrabajo   prestaciones superiores a la ley   disfrutar de nuestro programa global de bienestar  si quieres convertirte en un autentico prosegurer']
coordinador experiencia cliente;4;Se requiere profesional en en administración de empresas, ingeniería industrial o carreras afines. Deseable Especialización en Gerencia de Servicio o afines.  Con experiencia de más de 3 años en procesos de experiencia del cliente, implementación de modelos de experiencia, voz del cliente, manejo y mejora de NPS, implementación y operación de aplicativos CX. Show more ;se requiere profesional en en administracion de empresas, ingenieria industrial o carreras afines deseable especializacion en gerencia de servicio o afines  con experiencia de mas de  años en procesos de experiencia del cliente, implementacion de modelos de experiencia, voz del cliente, manejo y mejora de nps, implementacion y operacion de aplicativos cx show more ;['manejo y mejora de nps']
analista gobierno datos;4;¿Cuáles serán tus funciones?  Establecer estándares, políticas y procesos que determinen el uso, desarrollo y gestión de los datos a nivel de la compañía Dar seguimiento a la ejecución de los controles de calidad (mediante un cuadro de mando) y a los planes de remediación ejecutados por el equipo de Calidad de Datos Mantener y gestionar las herramientas de gobierno del dato, incluida la administración general del diccionario en su versión ofimática Apoyar al data owner en la definición de lineamientos para la gestión de datos y controles de calidad.   Requisitos   1 año de experiencia en áreas y posiciones similares. Haber participado en al menos 2 proyectos de implementación o mejora de Gobernanza de datos. Deseable haber desempeñado el rol de Analista o Profesional de Procesos, Eficiencia, Mejora Continua, Transformación.  Beneficios  ¿Qué beneficios tenemos?  Sueldo acorde al mercado laboral Ingreso a planilla desde el primer día de trabajo EPS Cobertura parcial para estudiar inglés. Agradable ambiente laboral Trabajo 100% remoto. Oportunidad de trabajar en el rubro de banca y finanzas  ¡TE ESTAMOS BUSCANDO!  Importante grupo empresarial enfocado en ofrecer servicios de Tecnología de la Información y Outsourcing. Nos encontramos en la búsqueda de un  Analista de Gobierno de Datos  ¿Te interesa unirte al equipo y trabajar para una de las principales compañías aseguradoras con más prestigio en el Perú? ¡Esta es tú oportunida Show more ;cuales seran tus funciones  establecer estandares, politicas y procesos que determinen el uso, desarrollo y gestion de los datos a nivel de la compañia dar seguimiento a la ejecucion de los controles de calidad (mediante un cuadro de mando) y a los planes de remediacion ejecutados por el equipo de calidad de datos mantener y gestionar las herramientas de gobierno del dato, incluida la administracion general del diccionario en su version ofimatica apoyar al data owner en la definicion de lineamientos para la gestion de datos y controles de calidad   requisitos    año de experiencia en areas y posiciones similares haber participado en al menos  proyectos de implementacion o mejora de gobernanza de datos deseable haber desempeñado el rol de analista o profesional de procesos, eficiencia, mejora continua, transformacion  beneficios  que beneficios tenemos  sueldo acorde al mercado laboral ingreso a planilla desde el primer dia de trabajo eps cobertura parcial para estudiar ingles agradable ambiente laboral trabajo  remoto oportunidad de trabajar en el rubro de banca y finanzas  te estamos buscando  importante grupo empresarial enfocado en ofrecer servicios de tecnologia de la informacion y outsourcing nos encontramos en la busqueda de un  analista de gobierno de datos  te interesa unirte al equipo y trabajar para una de las principales compañias aseguradoras con mas prestigio en el peru esta es tu oportunida show more ;['desarrollo y gestion de los datos a nivel de la compañia dar seguimiento a la ejecucion de los controles de calidad (mediante un cuadro de mando) y a los planes de remediacion ejecutados por el equipo de calidad de datos mantener y gestionar las herramientas de gobierno del dato']
profesional tecnologia innovacion;4;RESPONSABILIDADES  Brindar soporte para fomentar el uso de las herramientas de tecnología que tiene la empresa. Apoyar en campañas de asimilación y adopción de nuevas tecnologías. Brindar soporte a la gestión integral de TI gestión de la demanda, operaciones, telefonía, infraestructura, licenciamiento, seguridad y gestión presupuestal. Participar en proyectos de infraestructura, telecomunicaciones y seguridad cloud, servidores, telefonía IP, red LAN y WAN y Wifi. Participar en proyectos de Innovación tecnológica   Requisitos   Formación  Egresado/Bachiller con formación universitaria en Ingeniería Industrial, Sistemas o Tecnologías de la información, apto para realizar prácticas profesionales por 12 meses. Haber culminado estudios universitarios.  Conocimientos  Se valorará la experiencia previa como practicante pre profesional manejando temas afines. Deseable manejo de herramientas Office 365 a nivel intermedio - avanzado. Deseable manejo de temas de innovación y transformación tecnológica. Deseable conocimientos de marketing digital. Habilidad para realizar talleres para acercar la tecnología a la gente.  Sede  REP Lima, Peru  Beneficios  Trabajo hibrido de lunes a viernes desde las 8 am hasta las 5 pm.  ISA REP - RED DE ENERGÍA DEL PERÚ S.A es la empresa líder en transmisión de energía eléctrica del Perú. Se especializa en la construcción, operación y mantenimiento de redes de transmisión de energía eléctrica en alta tensión. REP gestiona a dos importantes empresas del sector Consorcio Transmantaro e ISA Perú. Las tres son empresas de Interconexión Eléctrica S.A. -ISA- y cuentan con una red de subestaciones eléctricas y más de 10,000 kilómetros de líneas que recorren 21 regiones del Perú, usando la más moderna tecnología.  Somos una organización que genera CONEXIONES QUE INSPIRAN. Show more ;responsabilidades  brindar soporte para fomentar el uso de las herramientas de tecnologia que tiene la empresa apoyar en campañas de asimilacion y adopcion de nuevas tecnologias brindar soporte a la gestion integral de ti gestion de la demanda, operaciones, telefonia, infraestructura, licenciamiento, seguridad y gestion presupuestal participar en proyectos de infraestructura, telecomunicaciones y seguridad cloud, servidores, telefonia ip, red lan y wan y wifi participar en proyectos de innovacion tecnologica   requisitos   formacion  egresadobachiller con formacion universitaria en ingenieria industrial, sistemas o tecnologias de la informacion, apto para realizar practicas profesionales por  meses haber culminado estudios universitarios  conocimientos  se valorara la experiencia previa como practicante pre profesional manejando temas afines deseable manejo de herramientas office  a nivel intermedio  avanzado deseable manejo de temas de innovacion y transformacion tecnologica deseable conocimientos de marketing digital habilidad para realizar talleres para acercar la tecnologia a la gente  sede  rep lima, peru  beneficios  trabajo hibrido de lunes a viernes desde las  am hasta las  pm  isa rep  red de energia del peru sa es la empresa lider en transmision de energia electrica del peru se especializa en la construccion, operacion y mantenimiento de redes de transmision de energia electrica en alta tension rep gestiona a dos importantes empresas del sector consorcio transmantaro e isa peru las tres son empresas de interconexion electrica sa isa y cuentan con una red de subestaciones electricas y mas de , kilometros de lineas que recorren  regiones del peru, usando la mas moderna tecnologia  somos una organizacion que genera conexiones que inspiran show more ;['responsabilidades  brindar soporte para fomentar el uso de las herramientas de tecnologia que tiene la empresa apoyar en campañas de asimilacion y adopcion de nuevas tecnologias brindar soporte a la gestion integral de ti gestion de la demanda', 'apto para realizar practicas profesionales por  meses haber culminado estudios universitarios  conocimientos  se valorara la experiencia previa como practicante pre profesional manejando temas afines deseable manejo de herramientas office  a nivel intermedio  avanzado deseable manejo de temas de innovacion y transformacion tecnologica deseable conocimientos de marketing digital habilidad para realizar talleres para acercar la tecnologia a la gente  sede  rep lima', 'operacion y mantenimiento de redes de transmision de energia electrica en alta tension rep gestiona a dos importantes empresas del sector consorcio transmantaro e isa peru las tres son empresas de interconexion electrica sa isa y cuentan con una red de subestaciones electricas y mas de ']
