title_clean;link;description;desc;list_compe
jefe tecnologia informacion;7;Buscamos Jefe/a de Tecnología e Información, para importante grupo del sector retail, representante de las mejores marcas de moda mundial en Ecuador, con base en Quito.  Objetivo del cargo  Garantizar que los procesos del departamento de Tecnología e Información funcionen sin contratiempos y eficientemente, procurando el correcto funcionamiento de los sistemas informáticos y la seguridad de la información.  Responsabilidades  Asegurar el éxito e implementación de los diferentes proyectos de desarrollo de software. Monitorear el cumplimiento de los procesos de mantenimiento a la infraestructura de TI. Supervisar la correcta administración de las Bases de Datos, Redes de telecomunicación y Data center de la compañía. Supervisar los procesos de soporte a usuarios internos y externos. Garantizar la seguridad de la información de la compañía. Sugerir innovaciones tecnológicas para las diferentes áreas de gestión. Requisitos  Perfil  Estudios Tercer Nivel en Informática, Sistemas o afines. Experiencia mínimo 2 años como Jefe de Sistemas, TI, o afines.  Conocimientos  Gestión de proyectos, seguridad de la información, redes. Bases de datos, mantenimiento de infraestructura, gestión de indicadores.. Inglés intermedio. Excel avanzado.  Competencias  Liderazgo Orientación a resultados Planificación y organización Innovación e iniciativa Beneficios  Estabilidad Oportunidades de crecimiento Excelente paquete de beneficios de la empresa  ¿Quiénes Somos?  Human Brand es una firma especializada en Desarrollo Humano y Organizacional. Implementamos soluciones innovadoras para la gestión del talento de tu empresa.  Nacimos con el propósito de desarrollar el talento de las personas, creemos que el potencial humano es infinito y que puede brillar en las condiciones adecuadas. Para nosotros la base fundamental del éxito de cualquier empresa es el talento humano. Si tus colaboradores sienten pasión por lo que hacen, están motivados y aprendiendo constantemente, generarán valor para tu compañía. Show more ;buscamos jefea de tecnologia e informacion, para importante grupo del sector retail, representante de las mejores marcas de moda mundial en ecuador, con base en quito  objetivo del cargo  garantizar que los procesos del departamento de tecnologia e informacion funcionen sin contratiempos y eficientemente, procurando el correcto funcionamiento de los sistemas informaticos y la seguridad de la informacion  responsabilidades  asegurar el exito e implementacion de los diferentes proyectos de desarrollo de software monitorear el cumplimiento de los procesos de mantenimiento a la infraestructura de ti supervisar la correcta administracion de las bases de datos, redes de telecomunicacion y data center de la compañia supervisar los procesos de soporte a usuarios internos y externos garantizar la seguridad de la informacion de la compañia sugerir innovaciones tecnologicas para las diferentes areas de gestion requisitos  perfil  estudios tercer nivel en informatica, sistemas o afines experiencia minimo  años como jefe de sistemas, ti, o afines  conocimientos  gestion de proyectos, seguridad de la informacion, redes bases de datos, mantenimiento de infraestructura, gestion de indicadores ingles intermedio excel avanzado  competencias  liderazgo orientacion a resultados planificacion y organizacion innovacion e iniciativa beneficios  estabilidad oportunidades de crecimiento excelente paquete de beneficios de la empresa  quienes somos  human brand es una firma especializada en desarrollo humano y organizacional implementamos soluciones innovadoras para la gestion del talento de tu empresa  nacimos con el proposito de desarrollar el talento de las personas, creemos que el potencial humano es infinito y que puede brillar en las condiciones adecuadas para nosotros la base fundamental del exito de cualquier empresa es el talento humano si tus colaboradores sienten pasion por lo que hacen, estan motivados y aprendiendo constantemente, generaran valor para tu compañia show more ;['procurando el correcto funcionamiento de los sistemas informaticos y la seguridad de la informacion  responsabilidades  asegurar el exito e implementacion de los diferentes proyectos de desarrollo de software monitorear el cumplimiento de los procesos de mantenimiento a la infraestructura de ti supervisar la correcta administracion de las bases de datos', 'o afines  conocimientos  gestion de proyectos', 'mantenimiento de infraestructura']
inteligencia negocios;7;En Santander estamos impulsando y liderando una transformación centrada en lo cultural, utilizando la tecnología como driver y contando con las personas como parte protagónica de este proceso. Estamos cambiando la forma de concebir, diseñar y desarrollar productos, la forma de trabajar en equipo, de plantear objetivos, de desafiar al negocio y de subir la vara día a día, en todo lo que hacemos.     Queremos ser la mejor plataforma abierta de servicios financieros y para eso necesitamos personas que tengan ganas de romperla, de escribir una historia inédita en la industria local y que tengan mucho pero mucho empuje.     ¿A quiénes queremos sumar?     ¡Estamos buscando personas apasionadas de la tecnología y de los datos!     Serán responsables de:     La construcción de dashboards para visualización de KPIs, tendencias e insights relevantes para Tecnología. Identificar y comunicar proactivamente insights, tendencias y/o puntos de dolor que deban ser atendidos por los equipos de Tecnología. Creación de modelos de datos para que estos puedan ser explotados por los equipos de Tecnología, evitando todo tipo de manipulación manual, asegurando el acceso y la democratización de la información. Dar guidance a los equipos de Tecnología en la construcción de sus propios dashboards     Necesitamos que vengas con:     Conocimientos demostrables de SQL y los aspectos técnicos de BI Excelente habilidades analíticas y de resolución de problemas Conocimiento experto de herramientas de visualización de datos Proactividad. Excelente comunicación y trabajo en equipo     Y sería un golazo si además traes:     Experiencia relevante en el campo de Business Intelligence. Conocimientos de la industria IT Conocimientos de Python Conocimientos en Tableau o herramientas similares (ejemplos: PowerBI, Looker)        Es la oportunidad de ser parte de quienes escriben la historia. Significa sumarte al equipo que está liderando la transformación del banco hacia un producto totalmente digital, en un contexto de experimentación e innovación constante, pero contando al mismo tiempo con la estabilidad de una empresa consolidada y de reconocida trayectoria.        Tenemos un convenio exclusivo con Swiss Medical como medicina prepaga, cotización preferencial en productos bancarios, 3 semanas de vacaciones y descuentos en capacitación, universidades y otras casas de formación, entre otros beneficios.        Esta es tu oportunidad de generar un impacto real en el progreso de las personas, empresas y de la sociedad. En Santander, lo que hacés se nota.  Show more ;en santander estamos impulsando y liderando una transformacion centrada en lo cultural, utilizando la tecnologia como driver y contando con las personas como parte protagonica de este proceso estamos cambiando la forma de concebir, diseñar y desarrollar productos, la forma de trabajar en equipo, de plantear objetivos, de desafiar al negocio y de subir la vara dia a dia, en todo lo que hacemos     queremos ser la mejor plataforma abierta de servicios financieros y para eso necesitamos personas que tengan ganas de romperla, de escribir una historia inedita en la industria local y que tengan mucho pero mucho empuje     a quienes queremos sumar     estamos buscando personas apasionadas de la tecnologia y de los datos     seran responsables de     la construccion de dashboards para visualizacion de kpis, tendencias e insights relevantes para tecnologia identificar y comunicar proactivamente insights, tendencias yo puntos de dolor que deban ser atendidos por los equipos de tecnologia creacion de modelos de datos para que estos puedan ser explotados por los equipos de tecnologia, evitando todo tipo de manipulacion manual, asegurando el acceso y la democratizacion de la informacion dar guidance a los equipos de tecnologia en la construccion de sus propios dashboards     necesitamos que vengas con     conocimientos demostrables de sql y los aspectos tecnicos de bi excelente habilidades analiticas y de resolucion de problemas conocimiento experto de herramientas de visualizacion de datos proactividad excelente comunicacion y trabajo en equipo     y seria un golazo si ademas traes     experiencia relevante en el campo de business intelligence conocimientos de la industria it conocimientos de python conocimientos en tableau o herramientas similares (ejemplos powerbi, looker)        es la oportunidad de ser parte de quienes escriben la historia significa sumarte al equipo que esta liderando la transformacion del banco hacia un producto totalmente digital, en un contexto de experimentacion e innovacion constante, pero contando al mismo tiempo con la estabilidad de una empresa consolidada y de reconocida trayectoria        tenemos un convenio exclusivo con swiss medical como medicina prepaga, cotizacion preferencial en productos bancarios,  semanas de vacaciones y descuentos en capacitacion, universidades y otras casas de formacion, entre otros beneficios        esta es tu oportunidad de generar un impacto real en el progreso de las personas, empresas y de la sociedad en santander, lo que haces se nota  show more ;['asegurando el acceso y la democratizacion de la informacion dar guidance a los equipos de tecnologia en la construccion de sus propios dashboards     necesitamos que vengas con     conocimientos demostrables de sql y los aspectos tecnicos de bi excelente habilidades analiticas y de resolucion de problemas conocimiento experto de herramientas de visualizacion de datos proactividad excelente comunicacion y trabajo en equipo     y seria un golazo si ademas traes     experiencia relevante en el campo de business intelligence conocimientos de la industria it conocimientos de python conocimientos en tableau o herramientas similares (ejemplos powerbi looker)        es la oportunidad de ser parte de quienes escriben la historia significa sumarte al equipo que esta liderando la transformacion del banco hacia un producto totalmente digital']
banco talento it;7;Banco de Talentos de Cargill México - Tecnología de la Información (TI)  Cargill trabaja para alimentar al mundo de forma segura, responsable y sostenible, fortaleciendo las comunidades donde vive y trabaja. Para ello, reunimos el talento, las ideas y los recursos para ofrecer productos, tecnología y formas de operar que construyan negocios exitosos y comunidades enriquecidas.  Conectar nuestras numerosas empresas en más de 60 países no es tarea fácil. Sin embargo, los equipos de TI están a la altura del desafío. Únase a nosotros y apoyará los procesos centrales de Cargill, los datos empresariales, la información y las tecnologías mientras ayudamos a dar forma al futuro.  Todo esto ocurre con el valor de que todas las personas importan. La inclusión y la diversidad son pilares cruciales para alcanzar nuestros objetivos y nos permiten ser el socio más fiable en materia de agricultura, alimentación y nutrición.  Requisitos Técnicos  Licenciatura o Ingeniería terminada. Sólida experiencia en el trabajo de campo con: Programación, Negocio y análisis de requisitos, Data Science, Arquitectura, Infraestructura, Ingeniería de Datos, RPA, Proyectos de TI y funciones relacionadas del área de tecnología;banco de talentos de cargill mexico  tecnologia de la informacion (ti)  cargill trabaja para alimentar al mundo de forma segura, responsable y sostenible, fortaleciendo las comunidades donde vive y trabaja para ello, reunimos el talento, las ideas y los recursos para ofrecer productos, tecnologia y formas de operar que construyan negocios exitosos y comunidades enriquecidas  conectar nuestras numerosas empresas en mas de  paises no es tarea facil sin embargo, los equipos de ti estan a la altura del desafio unase a nosotros y apoyara los procesos centrales de cargill, los datos empresariales, la informacion y las tecnologias mientras ayudamos a dar forma al futuro  todo esto ocurre con el valor de que todas las personas importan la inclusion y la diversidad son pilares cruciales para alcanzar nuestros objetivos y nos permiten ser el socio mas fiable en materia de agricultura, alimentacion y nutricion  requisitos tecnicos  licenciatura o ingenieria terminada solida experiencia en el trabajo de campo con programacion, negocio y analisis de requisitos, data science, arquitectura, infraestructura, ingenieria de datos, rpa, proyectos de ti y funciones relacionadas del area de tecnologia;[]
ingeniero informatico;6;Llevamos casi 20 años entregando soluciones de punta basadas en la interpretación de Big Data generada por cientos de millones de personas alrededor del mundo, con el objetivo final de mejorar sus vidas.  Hemos mejorado el engagement y lealtad de los clientes finales, al mismo tiempo aumentando los ingresos de grandes empresas alrededor del mundo, en el mercado de las telecomunicaciones, servicios financieros y comercio minorista.  Nuestras soluciones se basan en servicios gestionados con tecnología de propiedad intelectual propia y patentada. Somos líderes en el mercado con más de 50 instalaciones en producción hoy día en clientes ubicados en 15 países;llevamos casi  años entregando soluciones de punta basadas en la interpretacion de big data generada por cientos de millones de personas alrededor del mundo, con el objetivo final de mejorar sus vidas  hemos mejorado el engagement y lealtad de los clientes finales, al mismo tiempo aumentando los ingresos de grandes empresas alrededor del mundo, en el mercado de las telecomunicaciones, servicios financieros y comercio minorista  nuestras soluciones se basan en servicios gestionados con tecnologia de propiedad intelectual propia y patentada somos lideres en el mercado con mas de  instalaciones en produccion hoy dia en clientes ubicados en  paises;[]
analista proyectos;6;ANALISTA DE PROYECTOSEn Banorte buscamos talento nico, fuerte y extraordinario, que impulse la transformacin e innovacin del pas, convirtindonos en un gran aliado para crecer fuerte con Mxico.Estamos convencidos que la combinacin de solidaridad, innovacin, respeto, lealtad y responsabilidad es la frmula perfecta para ser el mejor equipo del sector financiero.Objetivo del puesto Realizar anlisis de informacin a travs del uso de metodologas y prcticas para la generacin de informes de resultados.Funciones principales  Gestionar y dar seguimiento a proyectos del portafolio asignado. Analizar la informacin cualitativa y cuantitativa de proyectos. Proponer Investigar tcnicas de mejores prcticas para la comparativa de resultados. Disear presentaciones e informes de resultados. Identificar puntos de dolor en los flujos de procesos internos y proponer mejoras.Requisitos Profesionistas en rea de Ingenieria, Economa. Capacidad de evaluacin y anlisis. Contundencia y enfoque a dar resultados. Trabajo en equipo. Espritu innovador para la creacin de presentacin de informes.Haz clic en el botn aplicar yno pierdas la oportunidad de desarrollar todo tu potencial.Tipo de puesto Tiempo completoSalario 16,000.00 al mesBeneficios Vacaciones adicionales o permisos con goce de sueldoPago complementario Bono de productividadTipo de jornada Turno de 10 horas Show more ;analista de proyectosen banorte buscamos talento nico, fuerte y extraordinario, que impulse la transformacin e innovacin del pas, convirtindonos en un gran aliado para crecer fuerte con mxicoestamos convencidos que la combinacin de solidaridad, innovacin, respeto, lealtad y responsabilidad es la frmula perfecta para ser el mejor equipo del sector financieroobjetivo del puesto realizar anlisis de informacin a travs del uso de metodologas y prcticas para la generacin de informes de resultadosfunciones principales  gestionar y dar seguimiento a proyectos del portafolio asignado analizar la informacin cualitativa y cuantitativa de proyectos proponer investigar tcnicas de mejores prcticas para la comparativa de resultados disear presentaciones e informes de resultados identificar puntos de dolor en los flujos de procesos internos y proponer mejorasrequisitos profesionistas en rea de ingenieria, economa capacidad de evaluacin y anlisis contundencia y enfoque a dar resultados trabajo en equipo espritu innovador para la creacin de presentacin de informeshaz clic en el botn aplicar yno pierdas la oportunidad de desarrollar todo tu potencialtipo de puesto tiempo completosalario , al mesbeneficios vacaciones adicionales o permisos con goce de sueldopago complementario bono de productividadtipo de jornada turno de  horas show more ;[]
analista programador;6;Desempeño de rol de Analista Programador de Base de Datos con competencias de Analista Funcional. Levantar requerimientos del usuario. Revisar procesos y funcionalidades. Documentación de requerimientos. Autogestión. Desarrollo de cambios y/o nuevas funcionalidades. Requisitos Dominio en Base de Datos SQL SERVER (2008 o superior). Conocimiento y experiencia en Integration Services (SSIS) Conocimiento y experiencia en Reporting Services (SSRS) Conocimiento y experiencia en VB 6.0 Conocimiento y experiencia en .NET (Framework 4.0 ó superior) Conocimiento y experiencia en Access Conocimiento y experiencia en metodologías ágiles (Scrum) Conocimientos sobre Bitbucket Beneficios Horario laboral de lunes a viernes. Capacitación continua. Trabajo Remoto. Excelente clima laboral. Beneficios completos (planilla régimen general) según ley desde el primer día de labores.  Somos una empresa peruana con 18 años de experiencia ofreciendo soluciones basadas en tecnología de la información para el desarrollo sostenido del sector empresarial de nuestra sociedad. Tenemos el compromiso de ofrecer a nuestros clientes soluciones de valor agregado, empleando para ello las mejores prácticas internacionales con la colaboración de consultores de la más alta calidad y experiencia.  Brindamos nuestros servicios a clientes que van desde empresas de nivel corporativo, hasta empresas pequeñas y medianas en crecimiento. Asumimos los retos de nuestros clientes como si fueran nuestros, ya que no sólo tenemos el deseo de ayudar, sino el compromiso total para alcanzar nuestro máximo rendimiento.  En TeamSoft, promovemos un ambiente de colaboración y desarrollo profesional logrando un equipo integrado y comprometido. Asimismo, promovemos la innovación tecnológica dentro de la empresa lo que nos permite brindar las mejores soluciones con la más alta calidad del mercado. Show more ;desempeño de rol de analista programador de base de datos con competencias de analista funcional levantar requerimientos del usuario revisar procesos y funcionalidades documentacion de requerimientos autogestion desarrollo de cambios yo nuevas funcionalidades requisitos dominio en base de datos sql server ( o superior) conocimiento y experiencia en integration services (ssis) conocimiento y experiencia en reporting services (ssrs) conocimiento y experiencia en vb  conocimiento y experiencia en net (framework  o superior) conocimiento y experiencia en access conocimiento y experiencia en metodologias agiles (scrum) conocimientos sobre bitbucket beneficios horario laboral de lunes a viernes capacitacion continua trabajo remoto excelente clima laboral beneficios completos (planilla regimen general) segun ley desde el primer dia de labores  somos una empresa peruana con  años de experiencia ofreciendo soluciones basadas en tecnologia de la informacion para el desarrollo sostenido del sector empresarial de nuestra sociedad tenemos el compromiso de ofrecer a nuestros clientes soluciones de valor agregado, empleando para ello las mejores practicas internacionales con la colaboracion de consultores de la mas alta calidad y experiencia  brindamos nuestros servicios a clientes que van desde empresas de nivel corporativo, hasta empresas pequeñas y medianas en crecimiento asumimos los retos de nuestros clientes como si fueran nuestros, ya que no solo tenemos el deseo de ayudar, sino el compromiso total para alcanzar nuestro maximo rendimiento  en teamsoft, promovemos un ambiente de colaboracion y desarrollo profesional logrando un equipo integrado y comprometido asimismo, promovemos la innovacion tecnologica dentro de la empresa lo que nos permite brindar las mejores soluciones con la mas alta calidad del mercado show more ;['desempeño de rol de analista programador de base de datos con competencias de analista funcional levantar requerimientos del usuario revisar procesos y funcionalidades documentacion de requerimientos autogestion desarrollo de cambios yo nuevas funcionalidades requisitos dominio en base de datos sql server ( o superior) conocimiento y experiencia en integration services (ssis) conocimiento y experiencia en reporting services (ssrs) conocimiento y experiencia en vb  conocimiento y experiencia en net (framework  o superior) conocimiento y experiencia en access conocimiento y experiencia en metodologias agiles (scrum) conocimientos sobre bitbucket beneficios horario laboral de lunes a viernes capacitacion continua trabajo remoto excelente clima laboral beneficios completos (planilla regimen general) segun ley desde el primer dia de labores  somos una empresa peruana con  años de experiencia ofreciendo soluciones basadas en tecnologia de la informacion para el desarrollo sostenido del sector empresarial de nuestra sociedad tenemos el compromiso de ofrecer a nuestros clientes soluciones de valor agregado']
